full_text,cleaned_text,translated_text,stopwords,tweet_tokenize,stemmed_data,text_stemmed,pos,neg,neu,label
PC taehyung kak Udah ngadu ke cs sicepat tetapi respon dia cuma nyuruh kita hubungin market place untuk pergantian dana Dananya sudah dibalikin ke saya tetapi nggak sebanding sama harga Pcnya karena saya kan beli di GO jadi pas co cuma seharga pack saja,PC taehyung kak Udah ngadu ke cs tetapi respon dia cuma nyuruh kita hubungin market place untuk pergantian dana Dananya sudah dibalikin ke saya tetapi nggak sebanding sama harga Pcnya karena saya kan beli di GO jadi pas co cuma seharga pack saja,pc taehyung sis has complained to cs but the response he only told us to contact the market place for the replacement of funds funds have been reversed to me but it is not comparable to the price of the pc because i bought it at go so when i only cost it for pack,pc taehyung sis complained cs response told us contact market place replacement funds funds reversed comparable price pc bought go cost pack,"['pc', 'taehyung', 'sis', 'complained', 'cs', 'response', 'told', 'us', 'contact', 'market', 'place', 'replacement', 'funds', 'funds', 'reversed', 'comparable', 'price', 'pc', 'bought', 'go', 'cost', 'pack']","['pc', 'taehyung', 'si', 'complain', 'cs', 'respons', 'told', 'us', 'contact', 'market', 'place', 'replac', 'fund', 'fund', 'revers', 'compar', 'price', 'pc', 'bought', 'go', 'cost', 'pack']",pc taehyung si complain cs respons told us contact market place replac fund fund revers compar price pc bought go cost pack,0.0,0.106,0.894,negative
Halo kak paket kakak gagal pickup karena masih diproses di gudang ya kak mohon tunggu,Halo kak paket kakak gagal pickup karena masih diproses di gudang ya kak mohon tunggu,"hello sis, the package, brother failed to pickup because it was still processed in the warehouse, sis, please wait",hello sis package brother failed pickup still processed warehouse sis please wait,"['hello', 'sis', 'package', 'brother', 'failed', 'pickup', 'still', 'processed', 'warehouse', 'sis', 'please', 'wait']","['hello', 'si', 'packag', 'brother', 'fail', 'pickup', 'still', 'process', 'warehous', 'si', 'pleas', 'wait']",hello si packag brother fail pickup still process warehous si pleas wait,0.0,0.241,0.759,negative
UDAH DARI PAGI KOMPLAIN WHATSAPP TP SMP SKR GA ADA TINDAK LANJUT NO TIKET,UDAH DARI PAGI KOMPLAIN WHATSAPP TP SMP SKR GA ADA TINDAK LANJUT NO TIKET,already from morning complaints whatsapp but at junior high school there is no follow -up no ticket no,already morning complaints whatsapp junior high school follow up ticket,"['already', 'morning', 'complaints', 'whatsapp', 'junior', 'high', 'school', 'follow', 'up', 'ticket']","['alreadi', 'morn', 'complaint', 'whatsapp', 'junior', 'high', 'school', 'follow', 'up', 'ticket']",alreadi morn complaint whatsapp junior high school follow up ticket,0.0,0.196,0.804,negative
mas paketku criss cross itu nanti bagaimana Baru kali ini saya ada paket salah kirim alamat ini nomer resine,mas paketku criss cross itu nanti bagaimana Baru kali ini saya ada paket salah kirim alamat ini nomer resine,"bro, my package criss cross later, how about this time i have a wrong package to send this address. resine number",bro package criss cross later time wrong package send address resine number,"['bro', 'package', 'criss', 'cross', 'later', 'time', 'wrong', 'package', 'send', 'address', 'resine', 'number']","['bro', 'packag', 'criss', 'cross', 'later', 'time', 'wrong', 'packag', 'send', 'address', 'resin', 'number']",bro packag criss cross later time wrong packag send address resin number,0.09,0.215,0.694,negative
sudah complain via wa tetapi gaada kejelasan cuma dapat nomer pelaporan,sudah complain via wa tetapi gaada kejelasan cuma dapat nomer pelaporan,already complained via wa but there is no clarity only to be reported by reporting numbers,already complained via wa clarity reported reporting numbers,"['already', 'complained', 'via', 'wa', 'clarity', 'reported', 'reporting', 'numbers']","['alreadi', 'complain', 'via', 'wa', 'clariti', 'report', 'report', 'number']",alreadi complain via wa clariti report report number,0.133,0.255,0.612,negative
Aku ngedrop paket ke gudangnya njirrr Sumpah saya taunya sicepat dekat rumah saya tuh gudangnya itu drop pointnya malah saya tidak tahu dimana Itu gpp kan yak Kata kurir disana gpp yang penting resinya sudah ada tetapi saya worry saja wkwk,Aku ngedrop paket ke gudangnya njirrr Sumpah saya taunya dekat rumah saya tuh gudangnya itu drop pointnya malah saya tidak tahu dimana Itu gpp kan yak Kata kurir disana gpp yang penting resinya sudah ada tetapi saya worry saja wkwk,"i dropped the package to the warehouse, i swear, i know that i was near my house, the warehouse was dropped, instead i didn't know where it was gpp, i said the courier there gpp, the important thing",dropped package warehouse swear know near house warehouse dropped instead know gpp said courier gpp important thing,"['dropped', 'package', 'warehouse', 'swear', 'know', 'near', 'house', 'warehouse', 'dropped', 'instead', 'know', 'gpp', 'said', 'courier', 'gpp', 'important', 'thing']","['drop', 'packag', 'warehous', 'swear', 'know', 'near', 'hous', 'warehous', 'drop', 'instead', 'know', 'gpp', 'said', 'courier', 'gpp', 'import', 'thing']",drop packag warehous swear know near hous warehous drop instead know gpp said courier gpp import thing,0.0,0.278,0.722,negative
guys jangan lupa untuk ganti ekspedisi ke jnt sicepat yaa,guys jangan lupa untuk ganti ekspedisi ke yaa,guys don't forget to change the expedition to yaa,guys forget change expedition yaa,"['guys', 'forget', 'change', 'expedition', 'yaa']","['guy', 'forget', 'chang', 'expedit', 'yaa']",guy forget chang expedit yaa,0.0,0.322,0.678,negative
Sekali Sedang i hate u sistem ini kurir lempar dari ke dan akhirnya ini di JNE tidak jelas banget yaa tolong bolak balik di gerai tetapi tidak dikirim ke seller,Sekali Sedang i hate u sistem ini kurir lempar dari ke dan akhirnya ini di tidak jelas banget yaa tolong bolak balik di gerai tetapi tidak dikirim ke seller,"once i hate u this system throws from to and finally this is not very clear, please go back and forth at the outlet but not sent to the seller",hate u system throws finally clear please go back forth outlet sent seller,"['hate', 'u', 'system', 'throws', 'finally', 'clear', 'please', 'go', 'back', 'forth', 'outlet', 'sent', 'seller']","['hate', 'u', 'system', 'throw', 'final', 'clear', 'pleas', 'go', 'back', 'forth', 'outlet', 'sent', 'seller']",hate u system throw final clear pleas go back forth outlet sent seller,0.15,0.214,0.636,negative
gw pernah si mengalamin hal buruk sma sicepat paket gw yang totalnya k berisi essentials mandi skin hair and body cair itu nyasar dan gw gatau itu foto rumahnya dimana ya kalau nyasar berapa puluh ma santai ini k terus isinya barang essentials,gw pernah si mengalamin hal buruk sma paket gw yang totalnya k berisi essentials mandi skin hair and body cair itu nyasar dan gw gatau itu foto rumahnya dimana ya kalau nyasar berapa puluh ma santai ini k terus isinya barang essentials,"i once experienced a bad thing for my high school package, whose total ke contains essentials bathing skin hair and liquid body is lost and i don't know, where is the photo of the house where if you stray how many tens of ma relax",experienced bad thing high school package whose total ke contains essentials bathing skin hair liquid body lost know photo house stray many tens relax,"['experienced', 'bad', 'thing', 'high', 'school', 'package', 'whose', 'total', 'ke', 'contains', 'essentials', 'bathing', 'skin', 'hair', 'liquid', 'body', 'lost', 'know', 'photo', 'house', 'stray', 'many', 'tens', 'relax']","['experienc', 'bad', 'thing', 'high', 'school', 'packag', 'whose', 'total', 'ke', 'contain', 'essenti', 'bath', 'skin', 'hair', 'liquid', 'bodi', 'lost', 'know', 'photo', 'hous', 'stray', 'mani', 'ten', 'relax']",experienc bad thing high school packag whose total ke contain essenti bath skin hair liquid bodi lost know photo hous stray mani ten relax,0.098,0.195,0.707,negative
MASI GALAUIN POCA JH CARLAND YG DIILANGIN SAMA SICEPAT FAAKKKKK,MASI GALAUIN POCA JH CARLAND YG DIILANGIN SAMA FAAKKKKK,still upset jh carland's girlfriend who was eliminated by kk,still upset jh carlands girlfriend eliminated kk,"['still', 'upset', 'jh', 'carlands', 'girlfriend', 'eliminated', 'kk']","['still', 'upset', 'jh', 'carland', 'girlfriend', 'elimin', 'kk']",still upset jh carland girlfriend elimin kk,0.248,0.257,0.495,negative
Kurir sicepat beneran lelet,Kurir beneran lelet,courier is really slow,courier really slow,"['courier', 'really', 'slow']","['courier', 'realli', 'slow']",courier realli slow,0.0,0.429,0.571,negative
Sudah saya hubungi tetapi tidak ada respon dan saya juga sudah pernah hubungi bagian it tetapi tidak ada jawaban atas permasalahan nya,Sudah saya hubungi tetapi tidak ada respon dan saya juga sudah pernah hubungi bagian it tetapi tidak ada jawaban atas permasalahan nya,i have contacted but there is no response and i have also contacted the it section but there is no answer to the problem,contacted response also contacted section answer problem,"['contacted', 'response', 'also', 'contacted', 'section', 'answer', 'problem']","['contact', 'respons', 'also', 'contact', 'section', 'answer', 'problem']",contact respons also contact section answer problem,0.0,0.31,0.69,negative
Paket saya juga begitu tetapi bedanya stuck di Jakarta sudah harian,Paket saya juga begitu tetapi bedanya stuck di Jakarta sudah harian,"my package is too, but the difference is stuck in jakarta is already daily",package too difference stuck jakarta already daily,"['package', 'too', 'difference', 'stuck', 'jakarta', 'already', 'daily']","['packag', 'too', 'differ', 'stuck', 'jakarta', 'alreadi', 'daili']",packag too differ stuck jakarta alreadi daili,0.0,0.25,0.75,negative
Sicepat id expres Anteraja kalau bisa hindarin ekxpedisi itu kurir nya sulit,id expres kalau bisa hindarin ekxpedisi itu kurir nya sulit,"id expres if you can avoid expeditions, the courier is difficult",id expres avoid expeditions courier difficult,"['id', 'expres', 'avoid', 'expeditions', 'courier', 'difficult']","['id', 'expr', 'avoid', 'expedit', 'courier', 'difficult']",id expr avoid expedit courier difficult,0.0,0.54,0.46,negative
Ninja express kediri ke malang bisa hari surabaya malang perjalanan jam lebih ini supir mabok apa masuk gigi ngegasnya tidak sampe jam heh lain kali sediain LEX saja atau jnt sicepat jangan yang lain jne minggu tidak kirimlibur,Ninja express kediri ke malang bisa hari surabaya malang perjalanan jam lebih ini supir mabok apa masuk gigi ngegasnya tidak sampe jam heh lain kali sediain LEX saja atau jangan yang lain minggu tidak kirimlibur,"ninja express kediri to malang can be malang, this trip more time, the driver is drunk, the driver is drunk in the dental, not until the time, heh, next time, or not, or not the other week, don't send it",ninja express kediri malang malang trip time driver drunk driver drunk dental time heh next time not week send,"['ninja', 'express', 'kediri', 'malang', 'malang', 'trip', 'time', 'driver', 'drunk', 'driver', 'drunk', 'dental', 'time', 'heh', 'next', 'time', 'not', 'week', 'send']","['ninja', 'express', 'kediri', 'malang', 'malang', 'trip', 'time', 'driver', 'drunk', 'driver', 'drunk', 'dental', 'time', 'heh', 'next', 'time', 'not', 'week', 'send']",ninja express kediri malang malang trip time driver drunk driver drunk dental time heh next time not week send,0.0,0.286,0.714,negative
Eh sicepat apaan dah gagal pickup alesannya saya yang reschedule ke besok Daritadi saya nungguin abangnya cokk curiga yang kemaren tuh juga blio tidak dateng tetapi asal bikin keterangan saya yang resched,Eh apaan dah gagal pickup alesannya saya yang reschedule ke besok Daritadi saya nungguin abangnya cokk curiga yang kemaren tuh juga blio tidak dateng tetapi asal bikin keterangan saya yang resched,eh what has failed my alesale pickup who rescheduled to tomorrow from the time i waited for his brother to be suspicious that yesterday also blio did not come but as long as i made my statement that was resched,eh failed alesale pickup rescheduled tomorrow time waited brother suspicious yesterday also blio come long made statement resched,"['eh', 'failed', 'alesale', 'pickup', 'rescheduled', 'tomorrow', 'time', 'waited', 'brother', 'suspicious', 'yesterday', 'also', 'blio', 'come', 'long', 'made', 'statement', 'resched']","['eh', 'fail', 'alesal', 'pickup', 'reschedul', 'tomorrow', 'time', 'wait', 'brother', 'suspici', 'yesterday', 'also', 'blio', 'come', 'long', 'made', 'statement', 'resch']",eh fail alesal pickup reschedul tomorrow time wait brother suspici yesterday also blio come long made statement resch,0.0,0.171,0.829,negative
eh masa stuck saja sih kirim dong cepetan,eh masa stuck saja sih kirim dong cepetan,"eh, it's just stuck, please send it fast",eh stuck please send fast,"['eh', 'stuck', 'please', 'send', 'fast']","['eh', 'stuck', 'pleas', 'send', 'fast']",eh stuck pleas send fast,0.231,0.308,0.462,negative
NoResi tujuan Semarang dari tanggal Juni sampai sekarang belum sampai jugabolak balik komplain cs via wa tetapi jawabannya dimaximalkan terus di DM tidak direspon,NoResi tujuan Semarang dari tanggal Juni sampai sekarang belum sampai jugabolak balik komplain cs via wa tetapi jawabannya dimaximalkan terus di DM tidak direspon,noresi destination semarang from june until now has not yet reached the cs complaint via wa but the answer is continued to continue at dm not responded to,noresi destination semarang june yet reached cs complaint via wa answer continued continue dm responded,"['noresi', 'destination', 'semarang', 'june', 'yet', 'reached', 'cs', 'complaint', 'via', 'wa', 'answer', 'continued', 'continue', 'dm', 'responded']","['noresi', 'destin', 'semarang', 'june', 'yet', 'reach', 'cs', 'complaint', 'via', 'wa', 'answer', 'continu', 'continu', 'dm', 'respond']",noresi destin semarang june yet reach cs complaint via wa answer continu continu dm respond,0.067,0.135,0.798,negative
sbt mau tanya yang dom tebet kalau drop off sicepat dimana ya kalau oot kasih tahu saja ya makasiih,sbt mau tanya yang dom tebet kalau drop off dimana ya kalau oot kasih tahu saja ya makasiih,"sbt want to ask the one who dom is tebet if drop off where if oot just tell me, then",sbt want ask one dom tebet drop oot tell me,"['sbt', 'want', 'ask', 'one', 'dom', 'tebet', 'drop', 'oot', 'tell', 'me']","['sbt', 'want', 'ask', 'one', 'dom', 'tebet', 'drop', 'oot', 'tell', 'me']",sbt want ask one dom tebet drop oot tell me,0.114,0.184,0.702,negative
ANEH barang HILANG tidak nyampe alamat malah status SELESAI Duit mau masuk ke penjual aneh disuruh lapor gaada solusi CS tidak informatif,ANEH barang HILANG tidak nyampe alamat malah status SELESAI Duit mau masuk ke penjual aneh disuruh lapor gaada solusi CS tidak informatif,strange lost items do not arrive the address instead of the status finished the money want to go to the strange seller is told to report the cs solution is not informative,strange lost items arrive address instead status finished money want go strange seller told report cs solution informative,"['strange', 'lost', 'items', 'arrive', 'address', 'instead', 'status', 'finished', 'money', 'want', 'go', 'strange', 'seller', 'told', 'report', 'cs', 'solution', 'informative']","['strang', 'lost', 'item', 'arriv', 'address', 'instead', 'statu', 'finish', 'money', 'want', 'go', 'strang', 'seller', 'told', 'report', 'cs', 'solut', 'inform']",strang lost item arriv address instead statu finish money want go strang seller told report cs solut inform,0.066,0.117,0.816,negative
Sampah Ekspidisi terburuk,Sampah Ekspidisi terburuk,the worst expression waste,worst expression waste,"['worst', 'expression', 'waste']","['worst', 'express', 'wast']",worst express wast,0.0,0.672,0.328,negative
Perdian dari Sicepat gembel anying gagal ngambil bdst saya,Perdian dari gembel anying gagal ngambil bdst saya,perdian from gembel anying failed to take my bdst,perdian gembel anying failed take bdst,"['perdian', 'gembel', 'anying', 'failed', 'take', 'bdst']","['perdian', 'gembel', 'ani', 'fail', 'take', 'bdst']",perdian gembel ani fail take bdst,0.0,0.412,0.588,negative
yang pakai jne bakal saya kirim besok dehh soalnya satu paket lupa saya set pre order tetapi yang sicepat saya kirim jumat dehh harus print resi soalnya sudah tidak bisa tulis tangan,yang pakai bakal saya kirim besok dehh soalnya satu paket lupa saya set pre order tetapi yang saya kirim jumat dehh harus print resi soalnya sudah tidak bisa tulis tangan,i will send it tomorrow because one package forgotten i set pre -order but what i sent friday must print the receipt because i can't write a hand,send tomorrow one package forgotten set pre order sent friday must print receipt cant write hand,"['send', 'tomorrow', 'one', 'package', 'forgotten', 'set', 'pre', 'order', 'sent', 'friday', 'must', 'print', 'receipt', 'cant', 'write', 'hand']","['send', 'tomorrow', 'one', 'packag', 'forgotten', 'set', 'pre', 'order', 'sent', 'friday', 'must', 'print', 'receipt', 'cant', 'write', 'hand']",send tomorrow one packag forgotten set pre order sent friday must print receipt cant write hand,0.0,0.244,0.756,negative
Ada alasan kenapa milih pick up paket jam sekian tetapi tetep saja di pick up pada jam lain yang di luar jangka waktu pilihan kenapa ya apa sicepat ini kekurangan sdm untuk per wilayah jadinya orang kerja di banyak wilayah sudah sekian kali gagal pick up,Ada alasan kenapa milih pick up paket jam sekian tetapi tetep saja di pick up pada jam lain yang di luar jangka waktu pilihan kenapa ya apa ini kekurangan sdm untuk per wilayah jadinya orang kerja di banyak wilayah sudah sekian kali gagal pick up,"there is a reason why choosing a pick up package, but still picked up at another hour that is outside the time period of choice why this is the lack of human resources for per region so people work in many areas that have failed to pick up so many times",reason choosing pick package still picked another hour outside time period choice lack human resources per region people work many areas failed pick many times,"['reason', 'choosing', 'pick', 'package', 'still', 'picked', 'another', 'hour', 'outside', 'time', 'period', 'choice', 'lack', 'human', 'resources', 'per', 'region', 'people', 'work', 'many', 'areas', 'failed', 'pick', 'many', 'times']","['reason', 'choos', 'pick', 'packag', 'still', 'pick', 'anoth', 'hour', 'outsid', 'time', 'period', 'choic', 'lack', 'human', 'resourc', 'per', 'region', 'peopl', 'work', 'mani', 'area', 'fail', 'pick', 'mani', 'time']",reason choos pick packag still pick anoth hour outsid time period choic lack human resourc per region peopl work mani area fail pick mani time,0.0,0.201,0.799,negative
Katanya tuh ada paket mau dikirim tetapi alamatnya kurang jelas padahal biasanya saya pakai alamat itu juga nyampe saja dan waktu saya pakai jasa sicepat kapan itu juga nyampe saja paketnya,Katanya tuh ada paket mau dikirim tetapi alamatnya kurang jelas padahal biasanya saya pakai alamat itu juga nyampe saja dan waktu saya pakai jasa kapan itu juga nyampe saja paketnya,he said there was a package to be sent but the address was unclear even though i usually use the address also arrive and when i use the services when it also arrived at the package,said package sent address unclear even though usually use address also arrive use services also arrived package,"['said', 'package', 'sent', 'address', 'unclear', 'even', 'though', 'usually', 'use', 'address', 'also', 'arrive', 'use', 'services', 'also', 'arrived', 'package']","['said', 'packag', 'sent', 'address', 'unclear', 'even', 'though', 'usual', 'use', 'address', 'also', 'arriv', 'use', 'servic', 'also', 'arriv', 'packag']",said packag sent address unclear even though usual use address also arriv use servic also arriv packag,0.0,0.111,0.889,negative
Ganti ngaran jadi si lambat we,Ganti ngaran jadi si lambat we,change to the ngaran to the slow one,change ngaran slow one,"['change', 'ngaran', 'slow', 'one']","['chang', 'ngaran', 'slow', 'one']",chang ngaran slow one,0.0,0.333,0.667,negative
kak bagaimana ya kok paketku salah kirim ini woy cek dm,kak bagaimana ya kok paketku salah kirim ini woy cek dm,"sis, how come my package is the wrong sending this woy check dm",sis come package wrong sending woy check dm,"['sis', 'come', 'package', 'wrong', 'sending', 'woy', 'check', 'dm']","['si', 'come', 'packag', 'wrong', 'send', 'woy', 'check', 'dm']",si come packag wrong send woy check dm,0.0,0.307,0.693,negative
Klo Sedang nganter tanya kurirnya nder serius deh ntr dia ngasih tahu juga kantor ekspedisi lain yang bisa drop point sicepat,Klo Sedang nganter tanya kurirnya nder serius deh ntr dia ngasih tahu juga kantor ekspedisi lain yang bisa drop point,"if you're going to ask the courier, you will be serious, he tells the other expedition office that can drop point",going ask courier serious tells expedition office drop point,"['going', 'ask', 'courier', 'serious', 'tells', 'expedition', 'office', 'drop', 'point']","['go', 'ask', 'courier', 'seriou', 'tell', 'expedit', 'offic', 'drop', 'point']",go ask courier seriou tell expedit offic drop point,0.0,0.208,0.792,negative
kesel sangat pengen marah tetapi gaada yang bisa disalahin ujung ujungnya lemes sendiri,kesel sangat pengen marah tetapi gaada yang bisa disalahin ujung ujungnya lemes sendiri,i want to be very angry but no one can be blamed for the edges,want angry one blamed edges,"['want', 'angry', 'one', 'blamed', 'edges']","['want', 'angri', 'one', 'blame', 'edg']",want angri one blame edg,0.194,0.358,0.448,negative
sicepat ganti saja jadi sikont bisa tidak ajg sudah tidak ramah tidak responsif tidak diambil ambil gajelas sangat mana saya Sedang sakit,ganti saja jadi sikont bisa tidak ajg sudah tidak ramah tidak responsif tidak diambil ambil gajelas sangat mana saya Sedang sakit,"just change it to sikont, it can't be no friendly, not responsive, not taken, take a very clear, which i am sick",change sikont cant friendly responsive taken take clear sick,"['change', 'sikont', 'cant', 'friendly', 'responsive', 'taken', 'take', 'clear', 'sick']","['chang', 'sikont', 'cant', 'friendli', 'respons', 'taken', 'take', 'clear', 'sick']",chang sikont cant friendli respons taken take clear sick,0.202,0.256,0.543,negative
Sicepat halu tuh emang kecepatannya sangat halu alias lambat Dr kmrin paket tidak gerak padahal kalau pakai ekspedisi lain sat set sat set pasti tu paket dah smpe dari kmrin,halu tuh emang kecepatannya sangat halu alias lambat Dr kmrin paket tidak gerak padahal kalau pakai ekspedisi lain sat set sat set pasti tu paket dah smpe dari kmrin,"halu, the speed is very very slow, aka slow from kmrin, the package doesn't move, even though if you use another expedition, the set set will be the package from kmrin",halu speed slow aka slow kmrin package move even though use another expedition set set package kmrin,"['halu', 'speed', 'slow', 'aka', 'slow', 'kmrin', 'package', 'move', 'even', 'though', 'use', 'another', 'expedition', 'set', 'set', 'package', 'kmrin']","['halu', 'speed', 'slow', 'aka', 'slow', 'kmrin', 'packag', 'move', 'even', 'though', 'use', 'anoth', 'expedit', 'set', 'set', 'packag', 'kmrin']",halu speed slow aka slow kmrin packag move even though use anoth expedit set set packag kmrin,0.0,0.167,0.833,negative
Makin lama pelayanan amburadul masa dari bogor ke Karawang hari pengiriman kalah sama sicepat dari Tegal ke Karawang dibawah Jam,Makin lama pelayanan amburadul masa dari bogor ke Karawang hari pengiriman kalah sama dari Tegal ke Karawang dibawah Jam,the longer the chaotic service from bogor to karawang the shipping day loses the same from tegal to karawang under the hour,longer chaotic service bogor karawang shipping day loses tegal karawang hour,"['longer', 'chaotic', 'service', 'bogor', 'karawang', 'shipping', 'day', 'loses', 'tegal', 'karawang', 'hour']","['longer', 'chaotic', 'servic', 'bogor', 'karawang', 'ship', 'day', 'lose', 'tegal', 'karawang', 'hour']",longer chaotic servic bogor karawang ship day lose tegal karawang hour,0.0,0.396,0.604,negative
sicepat sekarang lelet sangat ya kalah cepet sama jnt,sekarang lelet sangat ya kalah cepet sama,now it's really slow to lose the same fast,really slow lose fast,"['really', 'slow', 'lose', 'fast']","['realli', 'slow', 'lose', 'fast']",realli slow lose fast,0.224,0.627,0.149,negative
ini mendingan id express tahu sicepat belum pernah dapet kurir dari ekspedisi ini mana liat review di twitter jelek banget lagi,ini mendingan id express tahu belum pernah dapet kurir dari ekspedisi ini mana liat review di twitter jelek banget lagi,"this is better to have express id, i have never got a courier from this expedition where to see the review on twitter, it's really bad",better express id never got courier expedition see review twitter really bad,"['better', 'express', 'id', 'never', 'got', 'courier', 'expedition', 'see', 'review', 'twitter', 'really', 'bad']","['better', 'express', 'id', 'never', 'got', 'courier', 'expedit', 'see', 'review', 'twitter', 'realli', 'bad']",better express id never got courier expedit see review twitter realli bad,0.177,0.213,0.61,negative
