full_text,cleaned_text,translated_text,stopwords,tweet_tokenize,stemmed_data,text_stemmed,pos,neg,neu,label
perasaan pas itu aman tentram saja gaada yang genit lah jir bt sangat saya masa saya sudah Nonaktifkan pengiriman shopee sekarang harus nonaktifkan pengiriman sicepat,perasaan pas itu aman tentram saja gaada yang genit lah jir bt sangat saya masa saya sudah Nonaktifkan pengiriman shopee sekarang harus nonaktifkan pengiriman,"the feeling of the fitting is safe, it's not the most flirty that is so much that i am very deactivated by shopee delivery, now i have to deactivate shipping",feeling fitting safe flirty much deactivated shopee delivery deactivate shipping,"['feeling', 'fitting', 'safe', 'flirty', 'much', 'deactivated', 'shopee', 'delivery', 'deactivate', 'shipping']","['feel', 'fit', 'safe', 'flirti', 'much', 'deactiv', 'shope', 'deliveri', 'deactiv', 'ship']",feel fit safe flirti much deactiv shope deliveri deactiv ship,0.403,0.0,0.597,positive
jangan lagi pakai deh buat para seller paketku tidak di pick uppick up walaupun cuma satu saya pun tidak bisa dateng ke konter karena alamatnya itu dari kos dan tiba ada hal urgent yang tidak bisa ditinggal di rumah waktu sudah req pick up,jangan lagi pakai deh buat para seller paketku tidak di pick uppick up walaupun cuma satu saya pun tidak bisa dateng ke konter karena alamatnya itu dari kos dan tiba ada hal urgent yang tidak bisa ditinggal di rumah waktu sudah req pick up,"don't use it anymore for the seller of my package, i am not picking up even though only one of me can't come to the counter because the address is from the boarding house and there is an urgent thing that cannot be left at home",use anymore seller package picking even though one cant come counter address boarding house urgent thing cannot left home,"['use', 'anymore', 'seller', 'package', 'picking', 'even', 'though', 'one', 'cant', 'come', 'counter', 'address', 'boarding', 'house', 'urgent', 'thing', 'cannot', 'left', 'home']","['use', 'anymor', 'seller', 'packag', 'pick', 'even', 'though', 'one', 'cant', 'come', 'counter', 'address', 'board', 'hous', 'urgent', 'thing', 'cannot', 'left', 'home']",use anymor seller packag pick even though one cant come counter address board hous urgent thing cannot left home,0.091,0.0,0.909,positive
SiCepat yang tidak lagi cepat,yang tidak lagi cepat,which is no longer fast,longer fast,"['longer', 'fast']","['longer', 'fast']",longer fast,0.6,0.0,0.4,positive
eh seriusan seng saya jnt sama sicepat yang plng amn sejauh ini,eh seriusan seng saya sama yang plng amn sejauh ini,eh seriously zinc the same as the safest so far,eh seriously zinc safest far,"['eh', 'seriously', 'zinc', 'safest', 'far']","['eh', 'serious', 'zinc', 'safest', 'far']",eh serious zinc safest far,0.386,0.186,0.429,positive
Perasaan waktu itu sicepat aman saja sekarang kok jadi gini Tau begitu saya matiin saja opsinya,Perasaan waktu itu aman saja sekarang kok jadi gini Tau begitu saya matiin saja opsinya,"the feeling of time was safe now, how come i know that once i just turn off the option",feeling time safe now come know turn option,"['feeling', 'time', 'safe', 'now', 'come', 'know', 'turn', 'option']","['feel', 'time', 'safe', 'now', 'come', 'know', 'turn', 'option']",feel time safe now come know turn option,0.293,0.0,0.707,positive
saya paling kesel sama sicepat bye i love anteraja forever in my heart,saya paling kesel sama bye i love forever in my heart,i am the most upset by bye i love forever in my heart,upset bye love forever heart,"['upset', 'bye', 'love', 'forever', 'heart']","['upset', 'bye', 'love', 'forev', 'heart']",upset bye love forev heart,0.646,0.2,0.154,positive
Waduh drpd jnt saya masih agak percaya jne sekarang malah takut sicepat kmrin oke di saya Atau tiki juga bisa,Waduh drpd saya masih agak percaya sekarang malah takut kmrin oke di saya Atau tiki juga bisa,"wow, i still believe that i am a bit of being afraid that i am afraid of kmrin, okay in me or tiki can too",wow still believe bit afraid afraid kmrin okay tiki,"['wow', 'still', 'believe', 'bit', 'afraid', 'afraid', 'kmrin', 'okay', 'tiki']","['wow', 'still', 'believ', 'bit', 'afraid', 'afraid', 'kmrin', 'okay', 'tiki']",wow still believ bit afraid afraid kmrin okay tiki,0.449,0.0,0.551,positive
UDAH AKU BALES pakai kekuatan sicepat,UDAH AKU BALES pakai kekuatan,i've been replying to strength,ive replying strength,"['ive', 'replying', 'strength']","['ive', 'repli', 'strength']",ive repli strength,0.615,0.0,0.385,positive
Sicepat tidak jelas banget sumpah dah,tidak jelas banget sumpah dah,it's not very clear to swear,clear swear,"['clear', 'swear']","['clear', 'swear']",clear swear,0.684,0.316,0.0,positive
Wah ternyata versi kolab ini beda packaging nya ya Akhirnya punya ttd dokter sebeh semehku mesti bangga Bakal tak pajang di kamar mandi Makasih Kanky Tokopedia dan SiCepat,Wah ternyata versi kolab ini beda packaging nya ya Akhirnya punya ttd dokter sebeh semehku mesti bangga Bakal tak pajang di kamar mandi Makasih Kanky Tokopedia dan,"wow, it turns out that this kolab version is different in the packaging, finally i have a doctor's ttd, so i have to be proud of not displaying in the bathroom, thanks to kanky tokopedia and",wow turns kolab version different packaging finally doctors ttd proud displaying bathroom thanks kanky tokopedia,"['wow', 'turns', 'kolab', 'version', 'different', 'packaging', 'finally', 'doctors', 'ttd', 'proud', 'displaying', 'bathroom', 'thanks', 'kanky', 'tokopedia']","['wow', 'turn', 'kolab', 'version', 'differ', 'packag', 'final', 'doctor', 'ttd', 'proud', 'display', 'bathroom', 'thank', 'kanki', 'tokopedia']",wow turn kolab version differ packag final doctor ttd proud display bathroom thank kanki tokopedia,0.439,0.0,0.561,positive
saya sudah minggu padahal co sudah dari mei haha,saya sudah minggu padahal co sudah dari mei haha,i have been sunday even though co is from may haha,sunday even though co may haha,"['sunday', 'even', 'though', 'co', 'may', 'haha']","['sunday', 'even', 'though', 'co', 'may', 'haha']",sunday even though co may haha,0.375,0.0,0.625,positive
Udah di hubungi tetapi tidak ada respon dari cs care sicepat,Udah di hubungi tetapi tidak ada respon dari cs care,already contacted but there is no response from cs care,already contacted response cs care,"['already', 'contacted', 'response', 'cs', 'care']","['alreadi', 'contact', 'respons', 'cs', 'care']",alreadi contact respons cs care,0.444,0.0,0.556,positive
buat tementemen yang belum paham sistem COD di shopee itu bukan saya yang anter ke rumah kalian dan nyari duitnya ya penjual saya cukup kirim barang ke ekspedisi JampT sicepat JNE dll lalu yang urus pengantaran paket itu pihak mereka bukan saya yang antar ke rumah ya,buat tementemen yang belum paham sistem COD di shopee itu bukan saya yang anter ke rumah kalian dan nyari duitnya ya penjual saya cukup kirim barang ke ekspedisi JampT dll lalu yang urus pengantaran paket itu pihak mereka bukan saya yang antar ke rumah ya,"for the meeting that does not understand the cod system in shopee, it is not me who quites your house and looking for the money, my seller is enough to send the goods to the jampt expedition, etc.",meeting understand cod system shopee quites house looking money seller enough send goods jampt expedition etc,"['meeting', 'understand', 'cod', 'system', 'shopee', 'quites', 'house', 'looking', 'money', 'seller', 'enough', 'send', 'goods', 'jampt', 'expedition', 'etc']","['meet', 'understand', 'cod', 'system', 'shope', 'quit', 'hous', 'look', 'money', 'seller', 'enough', 'send', 'good', 'jampt', 'expedit', 'etc']",meet understand cod system shope quit hous look money seller enough send good jampt expedit etc,0.162,0.0,0.838,positive
coba saja kalau semua ekspedisi ada sistem pickup paket ky sicepat berapapun nominalnya juga saya ttp ladenin kalau mau co non event sekarang cuma sicepat kebijakan shopee aktifin shopee express wkwowkwk yang gamau pickup paket kaya jnt,coba saja kalau semua ekspedisi ada sistem pickup paket ky berapapun nominalnya juga saya ttp ladenin kalau mau co non event sekarang cuma kebijakan shopee aktifin shopee express wkwowkwk yang gamau pickup paket kaya,"try it if all the expeditions have a ky package pickup system, whatever nominal, i will also be ladenin if you want co non event now, only shopee policy to activate shopee express wkwowkwk who is not a rich package pickup package",try expeditions ky package pickup system whatever nominal also ladenin want co non event now shopee policy activate shopee express wkwowkwk rich package pickup package,"['try', 'expeditions', 'ky', 'package', 'pickup', 'system', 'whatever', 'nominal', 'also', 'ladenin', 'want', 'co', 'non', 'event', 'now', 'shopee', 'policy', 'activate', 'shopee', 'express', 'wkwowkwk', 'rich', 'package', 'pickup', 'package']","['tri', 'expedit', 'ky', 'packag', 'pickup', 'system', 'whatev', 'nomin', 'also', 'ladenin', 'want', 'co', 'non', 'event', 'now', 'shope', 'polici', 'activ', 'shope', 'express', 'wkwowkwk', 'rich', 'packag', 'pickup', 'packag']",tri expedit ky packag pickup system whatev nomin also ladenin want co non event now shope polici activ shope express wkwowkwk rich packag pickup packag,0.176,0.0,0.824,positive
kayanya dia kerja di ekspedisi macam jnt atau sicepat deh kak cb iseng survey,kayanya dia kerja di ekspedisi macam atau deh kak cb iseng survey,i think he works in an expedition like or deh cb for a survey,think works expedition like deh cb survey,"['think', 'works', 'expedition', 'like', 'deh', 'cb', 'survey']","['think', 'work', 'expedit', 'like', 'deh', 'cb', 'survey']",think work expedit like deh cb survey,0.294,0.0,0.706,positive
langsung datangi cabang pengirimnya saja DP trakhir hal spt ini tidak bakal selesai cepat kalau cuma by phonechat terus jangan lua ajukan klain barang belum terima di tokopedianya,langsung datangi cabang pengirimnya saja DP trakhir hal spt ini tidak bakal selesai cepat kalau cuma by phonechat terus jangan lua ajukan klain barang belum terima di tokopedianya,"just go directly to the sender branch, the last dp thing like this will not be finished quickly if only by phonechat keeps not submitting the klain the goods have not received it in the tokopedianya",go directly sender branch last dp thing like finished quickly phonechat keeps submitting klain goods received tokopedianya,"['go', 'directly', 'sender', 'branch', 'last', 'dp', 'thing', 'like', 'finished', 'quickly', 'phonechat', 'keeps', 'submitting', 'klain', 'goods', 'received', 'tokopedianya']","['go', 'directli', 'sender', 'branch', 'last', 'dp', 'thing', 'like', 'finish', 'quickli', 'phonechat', 'keep', 'submit', 'klain', 'good', 'receiv', 'tokopedianya']",go directli sender branch last dp thing like finish quickli phonechat keep submit klain good receiv tokopedianya,0.265,0.0,0.735,positive
noh liat tidak membantu,noh liat tidak membantu,noh clay doesn't help,noh clay help,"['noh', 'clay', 'help']","['noh', 'clay', 'help']",noh clay help,0.574,0.0,0.426,positive
admin paket saya kok belum sampai ya padahal saya pakai yang express biar cepet sampai Terus juga kok tidak ada tidak yang bisa dikontak sih,admin paket saya kok belum sampai ya padahal saya pakai yang express biar cepet sampai Terus juga kok tidak ada tidak yang bisa dikontak sih,"admin my package, how come i haven't arrived yet, even though i use the express, so i don't get it fast until it continues, how come there is nothing that can be contacted",admin package come arrived yet even though use express get fast continues come nothing contacted,"['admin', 'package', 'come', 'arrived', 'yet', 'even', 'though', 'use', 'express', 'get', 'fast', 'continues', 'come', 'nothing', 'contacted']","['admin', 'packag', 'come', 'arriv', 'yet', 'even', 'though', 'use', 'express', 'get', 'fast', 'continu', 'come', 'noth', 'contact']",admin packag come arriv yet even though use express get fast continu come noth contact,0.097,0.0,0.903,positive
Aku biasa pakai spx aman terus cepat juga prosesnya dan sicepat juga bagus kok,Aku biasa pakai aman terus cepat juga prosesnya dan juga bagus kok,i used to use it safe quickly and the process and also good,used use safe quickly process also good,"['used', 'use', 'safe', 'quickly', 'process', 'also', 'good']","['use', 'use', 'safe', 'quickli', 'process', 'also', 'good']",use use safe quickli process also good,0.537,0.0,0.463,positive
rasanya tidak enak nerimanya tetapi kalau kata mba ira saya pantes dapet treatment kaya gini Masha Allah,rasanya tidak enak nerimanya tetapi kalau kata mba ira saya pantes dapet treatment kaya gini Masha Allah,"it doesn't taste good, but if you say mba ira, i wonder you can get a treatment like this, masha allah",taste good say mba ira wonder get treatment like this masha allah,"['taste', 'good', 'say', 'mba', 'ira', 'wonder', 'get', 'treatment', 'like', 'this', 'masha', 'allah']","['tast', 'good', 'say', 'mba', 'ira', 'wonder', 'get', 'treatment', 'like', 'thi', 'masha', 'allah']",tast good say mba ira wonder get treatment like thi masha allah,0.351,0.0,0.649,positive
duh ini bagaimana ya baru pertama kali pakai dapet pengalaman seperti gini padahal di aplikasi lain kalau pakai alamat yang sama bisa sampai,duh ini bagaimana ya baru pertama kali pakai dapet pengalaman seperti gini padahal di aplikasi lain kalau pakai alamat yang sama bisa sampai,"this is the first time i use experience, i got an experience like this even though in another application if you use the same address",first time use experience got experience like even though another application use address,"['first', 'time', 'use', 'experience', 'got', 'experience', 'like', 'even', 'though', 'another', 'application', 'use', 'address']","['first', 'time', 'use', 'experi', 'got', 'experi', 'like', 'even', 'though', 'anoth', 'applic', 'use', 'address']",first time use experi got experi like even though anoth applic use address,0.172,0.0,0.828,positive
sbt gais ada yang tahu ini sender harus ngapain tempel resi manual saja bisa kan Sicepat halu ini,sbt gais ada yang tahu ini sender harus ngapain tempel resi manual saja bisa kan halu ini,sbt gais anyone knows this should be like this manual receipt can be this right?,sbt gais anyone knows like manual receipt right,"['sbt', 'gais', 'anyone', 'knows', 'like', 'manual', 'receipt', 'right']","['sbt', 'gai', 'anyon', 'know', 'like', 'manual', 'receipt', 'right']",sbt gai anyon know like manual receipt right,0.263,0.0,0.737,positive
Iya saya tuh kemarin lupa mau ganti karena trauma pakai sicepat nama saja sicepat tetapi lama banget nyampe tidak kuat,Iya saya tuh kemarin lupa mau ganti karena trauma pakai nama saja tetapi lama banget nyampe tidak kuat,"yes, i forgot to change yesterday because of trauma using the name but it was not strong enough for a long time",yes forgot change yesterday trauma using name strong enough long time,"['yes', 'forgot', 'change', 'yesterday', 'trauma', 'using', 'name', 'strong', 'enough', 'long', 'time']","['ye', 'forgot', 'chang', 'yesterday', 'trauma', 'use', 'name', 'strong', 'enough', 'long', 'time']",ye forgot chang yesterday trauma use name strong enough long time,0.219,0.185,0.596,positive
Selama ini paket ku aman saja kak mau jnt jne sicepat spx,Selama ini paket ku aman saja kak mau,"so far my package is safe, sis",far package safe sis,"['far', 'package', 'safe', 'sis']","['far', 'packag', 'safe', 'si']",far packag safe si,0.492,0.0,0.508,positive
Bu saya tahu Tokopedia dan Sicepat kawan sudah lama tetapi Sicepat bukan masa depan Tokopedia,Bu saya tahu Tokopedia dan kawan sudah lama tetapi bukan masa depan Tokopedia,ma'am i know tokopedia and friends have been a long time but not the future of tokopedia,maam know tokopedia friends long time future tokopedia,"['maam', 'know', 'tokopedia', 'friends', 'long', 'time', 'future', 'tokopedia']","['maam', 'know', 'tokopedia', 'friend', 'long', 'time', 'futur', 'tokopedia']",maam know tokopedia friend long time futur tokopedia,0.314,0.0,0.686,positive
Hi kak maaf buat tidak nyaman terkait kendala pesanan agar bisa mimin bantu pengecekan boleh infoin username shopee nomor pesanan melalui DM ke Sosial media kita ya Sehat SlaluBK,Hi kak maaf buat tidak nyaman terkait kendala pesanan agar bisa mimin bantu pengecekan boleh infoin username shopee nomor pesanan melalui DM ke Sosial media kita ya Sehat SlaluBK,hi sis sorry for uncomfortable regarding orders constraints so that they can help check the information can be used for the order of the order of the order by dm to our social media.,hi sis sorry uncomfortable regarding orders constraints help check information used order order order dm social media,"['hi', 'sis', 'sorry', 'uncomfortable', 'regarding', 'orders', 'constraints', 'help', 'check', 'information', 'used', 'order', 'order', 'order', 'dm', 'social', 'media']","['hi', 'si', 'sorri', 'uncomfort', 'regard', 'order', 'constraint', 'help', 'check', 'inform', 'use', 'order', 'order', 'order', 'dm', 'social', 'media']",hi si sorri uncomfort regard order constraint help check inform use order order order dm social media,0.144,0.0,0.856,positive
moj clearance sll era TNCT harg jangan jadi patokan incl all good condi kecuali tanda bisa kirim soremalam ini jampt only kirim besok spx sicepat jampt pic kanan tekol k only mention after dm,moj clearance sll era TNCT harg jangan jadi patokan incl all good condi kecuali tanda bisa kirim soremalam ini jampt only kirim besok jampt pic kanan tekol k only mention after dm,moj clearance sll in the tnct era harg don't be a benchmark incl all good condi except for the sign of sending this soremalam jampt only send tomorrow jampt right pic tekol k only mention after dm,moj clearance sll tnct era harg benchmark incl good condi except sign sending soremalam jampt send tomorrow jampt right pic tekol k mention dm,"['moj', 'clearance', 'sll', 'tnct', 'era', 'harg', 'benchmark', 'incl', 'good', 'condi', 'except', 'sign', 'sending', 'soremalam', 'jampt', 'send', 'tomorrow', 'jampt', 'right', 'pic', 'tekol', 'k', 'mention', 'dm']","['moj', 'clearanc', 'sll', 'tnct', 'era', 'harg', 'benchmark', 'incl', 'good', 'condi', 'except', 'sign', 'send', 'soremalam', 'jampt', 'send', 'tomorrow', 'jampt', 'right', 'pic', 'tekol', 'k', 'mention', 'dm']",moj clearanc sll tnct era harg benchmark incl good condi except sign send soremalam jampt send tomorrow jampt right pic tekol k mention dm,0.112,0.0,0.888,positive
paket saya kapan di pick up sudah hari tidak secepat namanya nihmana di keterangannya dirubah begitu lagi urusin lah ini kurir rekomendasi saya sudah bayar biaya potongannya saya sudah wa tetapi tidak respon makanya kesini,paket saya kapan di pick up sudah hari tidak secepat namanya nihmana di keterangannya dirubah begitu lagi urusin lah ini kurir rekomendasi saya sudah bayar biaya potongannya saya sudah wa tetapi tidak respon makanya kesini,"when my package is picked up the day is not as fast as the name is in the statement, it was changed again, it takes place this courier, i have paid the discount fee, but i don't respond here, so come here",package picked day fast name statement changed again takes place courier paid discount fee respond here come,"['package', 'picked', 'day', 'fast', 'name', 'statement', 'changed', 'again', 'takes', 'place', 'courier', 'paid', 'discount', 'fee', 'respond', 'here', 'come']","['packag', 'pick', 'day', 'fast', 'name', 'statement', 'chang', 'again', 'take', 'place', 'courier', 'paid', 'discount', 'fee', 'respond', 'here', 'come']",packag pick day fast name statement chang again take place courier paid discount fee respond here come,0.086,0.0,0.914,positive
Sengaja pakai kiriman sicepat sehari dari sopi biar cepet sampe tetapi status masih mandek dulu ok sekarang mlempem emang,Sengaja pakai kiriman sehari dari sopi biar cepet sampe tetapi status masih mandek dulu ok sekarang mlempem emang,deliberately use a shipment a day from shopee so that it can quickly arrive but the status is still stagnant first ok now it is really,deliberately use shipment day shopee quickly arrive status still stagnant first ok really,"['deliberately', 'use', 'shipment', 'day', 'shopee', 'quickly', 'arrive', 'status', 'still', 'stagnant', 'first', 'ok', 'really']","['deliber', 'use', 'shipment', 'day', 'shope', 'quickli', 'arriv', 'statu', 'still', 'stagnant', 'first', 'ok', 'realli']",deliber use shipment day shope quickli arriv statu still stagnant first ok realli,0.155,0.0,0.845,positive
kalau di tokped yang gratis ongkir kdkwa milih ekspedisi jka kwa kd hdk Sedang ku makai sicepat,kalau di tokped yang gratis ongkir kdkwa milih ekspedisi jka kwa kd hdk Sedang ku makai,"if in the tokped, the free postage of kdkwa chooses the jka kwa kdk hdk expedition while i use it",tokped free postage kdkwa chooses jka kwa kdk hdk expedition use,"['tokped', 'free', 'postage', 'kdkwa', 'chooses', 'jka', 'kwa', 'kdk', 'hdk', 'expedition', 'use']","['tokp', 'free', 'postag', 'kdkwa', 'choos', 'jka', 'kwa', 'kdk', 'hdk', 'expedit', 'use']",tokp free postag kdkwa choos jka kwa kdk hdk expedit use,0.248,0.0,0.752,positive
pagi kak ini paket saya stuck di Jakut lebih dari hari Dan estimasi sampai harusnya hari ini Mohon solusinya terima kasih,pagi kak ini paket saya stuck di Jakut lebih dari hari Dan estimasi sampai harusnya hari ini Mohon solusinya terima kasih,"in the morning, this package is stuck in north jakarta more than the day and estimation until today, please please the solution, thank you",morning package stuck north jakarta day estimation today please please solution thank,"['morning', 'package', 'stuck', 'north', 'jakarta', 'day', 'estimation', 'today', 'please', 'please', 'solution', 'thank']","['morn', 'packag', 'stuck', 'north', 'jakarta', 'day', 'estim', 'today', 'pleas', 'pleas', 'solut', 'thank']",morn packag stuck north jakarta day estim today pleas pleas solut thank,0.172,0.138,0.69,positive
halo admin drop point sicepat surabaya di mana saja ya kenapa banyak branch yang tidak mau nerima paket,halo admin drop point surabaya di mana saja ya kenapa banyak branch yang tidak mau nerima paket,"hello admin drop point surabaya anywhere, why are there so many branches who don't want to accept the package",hello admin drop point surabaya anywhere many branches want accept package,"['hello', 'admin', 'drop', 'point', 'surabaya', 'anywhere', 'many', 'branches', 'want', 'accept', 'package']","['hello', 'admin', 'drop', 'point', 'surabaya', 'anywher', 'mani', 'branch', 'want', 'accept', 'packag']",hello admin drop point surabaya anywher mani branch want accept packag,0.279,0.15,0.571,positive
Checkout barang tanggal Mei sampe tanggal Mei pakai SiCepat belum nyampe juga malahan baru tadi malem diproses pengiriman menuju kota tujuan Terus tanggal Mei tadi baru checkout barang Sedang tetapi kali ini pakai SPX terus hari ini barangnya sudah sampe SiCepat emg gblg,Checkout barang tanggal Mei sampe tanggal Mei pakai belum nyampe juga malahan baru tadi malem diproses pengiriman menuju kota tujuan Terus tanggal Mei tadi baru checkout barang Sedang tetapi kali ini pakai terus hari ini barangnya sudah sampe emg gblg,"checkout of goods on may until may use it, but it hasn't arrived yet, even just then was processed for shipping to the destination city and the may was just checkout, but this time it continued to use today the goods had arrived until emg gblg until today",checkout goods may may use it arrived yet even processed shipping destination city may checkout time continued use today goods arrived emg gblg today,"['checkout', 'goods', 'may', 'may', 'use', 'it', 'arrived', 'yet', 'even', 'processed', 'shipping', 'destination', 'city', 'may', 'checkout', 'time', 'continued', 'use', 'today', 'goods', 'arrived', 'emg', 'gblg', 'today']","['checkout', 'good', 'may', 'may', 'use', 'it', 'arriv', 'yet', 'even', 'process', 'ship', 'destin', 'citi', 'may', 'checkout', 'time', 'continu', 'use', 'today', 'good', 'arriv', 'emg', 'gblg', 'today']",checkout good may may use it arriv yet even process ship destin citi may checkout time continu use today good arriv emg gblg today,0.209,0.0,0.791,positive
panjang umur mas paked dari sicepat benar cepet sangat di gwwww,panjang umur mas paked dari benar cepet sangat di gwwww,"long lives, bro, used from right, very fast at gww",long lives bro used right fast gww,"['long', 'lives', 'bro', 'used', 'right', 'fast', 'gww']","['long', 'live', 'bro', 'use', 'right', 'fast', 'gww']",long live bro use right fast gww,0.2,0.0,0.8,positive
HAH saya kira sicepat aman,HAH saya kira aman,hah i think it's safe,hah think safe,"['hah', 'think', 'safe']","['hah', 'think', 'safe']",hah think safe,0.592,0.0,0.408,positive
Bukti Nomor Resi Pengiriman Via JNE Jasa pengiriman via JNE JampT SICEPAT Pembayaran via transfer Kami tidak melayani COD Cek Bukti Nomor Resi dan Paket Yang Sudah Sampai Daftar Menu,Bukti Nomor Resi Pengiriman Via Jasa pengiriman via JampT Pembayaran via transfer Kami tidak melayani COD Cek Bukti Nomor Resi dan Paket Yang Sudah Sampai Daftar Menu,proof of shipping receipt number via shipping service via jampt payment via transfer we do not serve cod check proof of receipt number and package that has reached the menu list,proof shipping receipt number via shipping service via jampt payment via transfer serve cod check proof receipt number package reached menu list,"['proof', 'shipping', 'receipt', 'number', 'via', 'shipping', 'service', 'via', 'jampt', 'payment', 'via', 'transfer', 'serve', 'cod', 'check', 'proof', 'receipt', 'number', 'package', 'reached', 'menu', 'list']","['proof', 'ship', 'receipt', 'number', 'via', 'ship', 'servic', 'via', 'jampt', 'payment', 'via', 'transfer', 'serv', 'cod', 'check', 'proof', 'receipt', 'number', 'packag', 'reach', 'menu', 'list']",proof ship receipt number via ship servic via jampt payment via transfer serv cod check proof receipt number packag reach menu list,0.163,0.0,0.837,positive
